,Date,Tweets
0,2020-05-20,jpmorgan says infection rates have declined in states where lockdowns have ended even after allowing for an appropriate measurement lag spy dji es aapl ba msft amzn brk goog fb jnj googl wmt pg stocks investingben is an ingrate he must sacrifice his job career and family atuser for a cheap fakedegree india h1b opt s386 replacement so 1 oligarchs richer aapl amzn bac fb vz ba msft ge googl ibm dis acn ctsh tcs wit hcl t vz cern cerner deloitte consultingberkshire spent about 35 billion on its 80 billion aapl stake the wise ones bet heavily when the world offers them that opportunity they bet big when they have the odds and the rest of the time they dont its just that simple  charlie munger sbes loaded more sbes 100x run coming spom ran 60x after rm announcement sbes is next i will take it otc alpp sbes grfn sfor spom aapl msft amzn fb googl tsla amd spy dji nyse nsdq btc xrp eththose that may be new to stocks faang facebook fb apple aapl amazon amzn netflix nflx google googl when one makes a new high or low  keep a close on the others these 5 typically run together big payday when u get on the right side of this trade i sure hope someone looked at the charts and chat content and decided to take action fb aapl or dis all 3 were analyzedaapl got no respect in the beginning and then it ended up changing the world  litecoin will be 100 x more influential in the 10 yrs decentralized censorship resistant privacy enabled value transfer is the future  you are a human being not a piece of data to be farmedwatchlist zm spy fb shop tsla aapl disawesome finally some use for all this tracking us apple google aapl googaapl is not going to sale to many iphones in chinamy largest dividend stock holdings include apple aapl johnson n johnson jnj goldman sachs gs coca cola ko microsoft msft wells fargo wfc what are yours and what would you add to this listfaamg  off their all time highs fb 0 aapl 26 amzn 0 msft 2 googl 76 wednesdays most activelytraded stocks fb amzn aapl tsla nvda msft mrna baba amd ba dow up 370 points or 15 sampp 500 up 17 nasdaq up 2 dia spy qqqaapl looks primed to breakout from this cup amp handle pattern on daily chart watch for intraday volume to show up as it takes out 320 to get in strong volume gives you conviction to get in a trade or stay in if already long if you made this trade youd be up about 500 today with aapl at 319 exactly 2 months laternow in member chat aapl ibm oil and reopening URLbtc 10500 eth 250 spx 3050 aapl 330 tsla 900 msft 195 twtr 36spy is up 4 needs above 2965 now to see higher support is 294 aapl 3 315 is support needs above 319 tsla 8 needs over 822 816 supports bynd 5 needs over 142 to see 145147150 1375 support fomc mins today playing the best amp sideline the rest hagd gl midweek review video 520 URL vix vvix tlt gld esf spy dia iwm kre ba nke jpm mcd cmg qqq smh lrcx nvda amd intc xbi ibb amgn gild mrna aapl nflx roku dis amzn wmt w rh cost googl fb shop pypl sq tsla stockmarketchinas state media has said countermeasures could come against us firms  including apple  because of washingtons moves to cut off chips from huawei but apple is likely to avoid the backlash heres why aapl a few winners today congrats to us if you took the swing calls with the team spy qqq fb dis nflx aapl tsla twtr mu bsx pton mrk amd nvda shop sq nke v ma bynd spce ge sdc mdb ehth zm clx tmus gild work snap roku twlo mrna ftnt pypltrust us you dont want to miss this aapl active members can get access for free through the professional development assistance program learn more here URL poweringtheprofessionesf 5 min rth tue   42 points range wed   24 points range esf spy spx trading futures cme mesf markets spy aapl optionstradingaapl settled 19 to 31923 nearing the feb historic high of 32634 who needs sales of ianything when the fed will be buying your corp debt so you can fund your buybacks understanding stock charts would have told you this aapl would hit 320 fb would hit 220 dis would hit 120 amzn would break out above 2476 time is money literally if youre trading options learn the basics and profitable strategies 30 some of todays most active stock options 52020 fb aapl twtr dis bynd amd tsla feye gildmay 21 2020 rth plan if rth open above 2966 target 3006 if rth open below 2958 expect 2910 offers below 2910 opens gate to 2893 and 285775 now 2968 esf esf spy spx ndx iwm aapl amzn fb nflx tsla googl baba qqqoption spread update 5 spreads open 3 bullish 2 bearish 14556 locked in so far patience is the name of the game congrats to everyone trading with me join now  URL lt v ibm nflx aapl gld amd baba sq tqqq tltmany names near the highs still consolidating spy sitting under 297 needs over aapl under 319 needs over fb still consolidating under the 230 big level needs a push shop at hod needs over 774 now not much follow through today just consolidatingin a bear market its always wise to protect portfolios while consistently booking profits on day trades we have a system that can help you do that join our 11 trade room today atuser have fun with your trading with us spy spx qqq aapl tsla amdsbes keep hitting the ask they are manipulating and shorting again you need to learn manipulators spom 20 but 10x bigger otc alpp sbes grfn sfor spom aapl msft amzn fb googl tsla amd spy dji nyse nsdq btc xrp ethwhat caused the stock market crash of 1929 URL spy aapl spx vixnames like aapl building up some pretty nasty divergence would take a lot to repair not saying short but i think upside is limited neartermspy spx es aapl goog tsl not done yet but might be todayour very own atuser storming out of the gate with some huge wins in our premium room URL aapl amd amzn bidu bynd cmg codx dis fb goog iwm lyft msft nflx qqq spy tlry tsla breadbox options trading stocks coronavirus covid19aapl under large level here keep on radar hard level 319 keyvuzix m400 smart glasses now support handsfree voice control for skype for business zoom and zoom for healthcare applications vuzi aapl goog tsla apple smartglasses stocks stockstobuytop watchers bynd tsla aapl fb shoptgt beats but will we see a repeat of wmt yesterday low has higher profit than hd due to not assisting employees the same way ual  clx partner jnj pulling powder cvs returns money aapl buying movie rights from sne mrna on shaky ground rcl bookings nndmaapl just realized its 14 away from ath whats your thoughts on the markets cycles howard marks has a pretty neat idea about them goes like this you cant predict you can prepare what do you think URL aapl amzn goog spy djia nnbrURL the present and the next decade is an intelligent economy bidu d but take note everyone else is also there same for amzn goog fb msft aapl baba nvda i just felt that more people have to give baidu some credit you knowi didnt realize nvda came out with a covid19 vaccine how can this valuation be possible this is just as bad as aapl product companies facing major headwinds unaccounted for in stock price spy is the etf of the sampp 500 and should always be on your watchlist as many of your favorite companies such as dis fb aapl goog nflx amzn hd and many others all fall under this ticketlink is increasing in volume and price did atuser just open a chainlink fund spy spx qqq iwm btc eth slv gdx dxy fb aapl tsla dis ba acb f ge vix zm pton bynd tlt gld vet chz xtzes esf 24hr amp daily the daily has been in a massive channel need a close above 2947 this would be super bullish till 3000 2 amp4hr are setting up w cloud amp bands very similar to the yellow box part of my thinking for a toursfriday hard rally spy spx amzn nflx aapl nothing to see here casually jumping 600 tryna be like my idol tsla nndm dia qqq spy aapl googk amzn roku nvdaaapl fb nvda ntes bynd all nice bounces after the close amp the over reaction to the newsaapl aapl all about the raindrop vs hollow candle tonight amzn and jcp talks send amzn to 52 week high load dips xspa jcp tti capr rvp cpe mrna nclh spom sbes nflx m mark prty qep oxy dxcm aapl home abt mro mpc teva shop mfa nvda amd msft tsla fb amzn srne pctl intc csco ccl amcspy my rinky dink indicator 1  still on sell but turning around to buy same is true for indicator 2  todays action  did not helped much esf spx trading futures cme mesf markets spy aapl optionstradingtop money flow today free stocks app URL bil spy msft amzn spts efa lqd iefa igsb aapl wday fb xlf iwm dis hyg goog ushy eemv byndand aapl near all time highs spy spx dia aapl tsla bears how do you put emotionsfeeings completely aside and get calls in a fomo market knowing the economy is fed how do you overlook the value bubble take advantage of the fomo i cant do it calls on metals and adding puts above 295 until rug pullis there anything left to buy URL aapl nndm vxx inpx dvax htbxesf 520 greenred possible bearish closed on tue fomc mins in pm on session 293046 possible 3008 2991 2978 2964 2954 2947rposshod 2930piovt 2920 2918 2916 2911 2908 2899 2885sposslod 2877 2873 2854 esf spx trading futures cme mesf markets spy aaplwmt lets see if i get my wish granted and they flush this pig back down to the 120 area after the company reported betterthanexpected q1 eps and sales results down to the 10sma would be nice sales up 10 and ecommerce up 74 long swing spy qqq fb aapl tsla twtr mudid gamestop just learn how to survive the digital gaming future atuser stocks gme ntdoy msft aapl bby sneaapl announces vaccinefb strong amzn ok googl ok aapl amp msft have the largest market caps  these 2 need to be strong to lead market higher atuser atuser please lead your stks up markets depend on you spy above ma200 very bullish macos 1015 catalinamacpath finder v96015off  aapl ch twitter for mac v819  aapl ch apple paid sony about 70 million for 15 years of streaming rights to the tom hanks film greyhound which cost about 50 million to make first time that hanks one of hollywoods biggest stars is going straight to streaming vod ott media aapl google chrome v83  aapl ch no one else is investing so aggressively in the podcast space as spot ek is positioning the company to become the yt for podcast itll be too late when competition realizes what hes doing and aapl is no threat as they are not in the ad businessapple aapl facebook fb amazon amzn technical analysis elliott wave 19 ma URL via atuser
1,2020-05-21,love it aapl top hey aapl call me we have some great shows and actually own the rights to them aapl  demark 13 sell today aapl has chewed through these signals in the past but riskreward seems decent given we are into past top resistance rsislo stoobv negatively diverging on this last move stocks trading stockstowatchbig tech returns in 2008 msft 44 aapl 57 googl 56 amzn 45 qqq 42 ytd returns in 2020 msft 17 aapl 9 googl 5 amzn 32 qqq 8this means apple aapl will buy atuser spot its just so much easier than trying to build from scratchaapl is seeking executive to lead original podcast effortapple is seeking an executive to lead original podcast effort apple is buying original podcasts that would be exclusive apples new podcasts will help promote tv video service apple faces threat from spotifys push into exclusive podcasts aapl spotrt top 8 things that would ignite twtr stock 1 relaunch vine 2 verification for all 3 twitter pro subscription revenue 4 listchannels launch 5 payments layer bitcoin or cashap 6 jack goes full time or exits 7 atuser offered ceo job 8 dis aapl acquisition aapl ndx nqf i dont like to ever say its the end but given the divergence at the new high and the appearance of a failed backtest its hard to believe well go higher in the shorttermwe had an interesting discussion in my qa class this morning and i wanted to pose this question if you had to choose to own either a smartphone or a car for the rest of your life but couldnt have both what would you choose aapl samsung goog uber lyft tsla gm fsbes i knew this everyone is going to chase higher and higher spom crash was created by big retail traders who placed a stop loss and created a big chain reaction with low bid liquidity learn to read the stocks and take advantage back to ath spy otc btc amzn aapl fbshop paid big ba paid big fb paid big aapl paid big spy hedge back to green id say thats a wrap my job is done for the day hope you all killed it hagd amp dont over trade beastout   qqq  spy daily wrote about this again in the newsletter this week its make or break time for the parabola sqqq tqqq ndx nqf fb aapl amzn msft nflx goog spy spx esf vix gld tlt tnx dxy trading stocks URLunemployment claims market give zero fks plus a few of the usual suspects acb tgod luv ino aapl spy URL pictwittercomrljubps1jnaapl pt raised to 345 from 330 atuser docu rbc raised to 150 from 8500 expe rbc raised to 9000 from 7100 fb pt raised to 26000 from 24500 atuser low keybanc maintains to overweight pt 13000my assessment of worlds largest stocks by market cap overvalued o fair n undervalued u thread aramco o msft n aapl o amzn o googl n fb o baba n 700 hk o brka n jnj n v n wmt n nesn n rog n ma n pg n jpm u unh nonly an idiot or a poser would buy a porsche and not drive it themselves thats the point of a porschegood evening spx closed below 2977 if holds above we rip to 299983gap fill amp below 2955 2944 support then 2934 2900 aapl big breakout at 320 325 then 327ish aths below 315 313 310 key support have a great night chart via atuseraapl  trade idea  may 22nd 3225c  bidask 125145 closed at 31923 needs to break through the 31969 resistance to test 327 next i would consider puts under 31050  amzn amd ba baba fb tsla roku tsla spx spy tdoc cost zm gild uso nvda roku bynd pictwittercombfw5nwboxyi am not downloading their update if they want to force contact tracing like bill hr6666 think ill even dump my aapl stock never will buy another apple product if they proceedit seems so clear here  at a major inflection point if we breakout  its going to be on good virus news and the hated banks airlines ba casinos iwm and travel stocks will lead the way in this scenario look for a pause in fang spy ba dis iwm ccl gs aaplaapl settled 07 to 31685 todays candle is a subtle bearish engulfing one and leans st bearish i remember back in late 2018 when the market mainly companies with operations in china took a dive  chinaus trade tensions are just noise  back in late 2018 apple was hit especially hard compared to sp and proved to be a great time to buy long aapl recap 521 chatter 22 zm  fb workplace spot  aapl podcasts push domo  takeover acb cgc cron tlry  cannabis treatprevent covid cemi  fda rating antibody testmore proof that cheap fakedegree racist india h1b s386 s386isfair parasites destroy usa worker jobs amp careers atuser atuser for 1 oligarchs at aapl amzn bac fb vz ba msft ge googl ibm dis acn ctsh tcs wit hcl t vz cern cerner deloitte consultingbrkb berkshire hathaway is more attractiveundervalued now then it was at low of 160 on a risk adjusted basis a lot of the tail risks buffett was concerned about at agm have been greatly reduced meanwhile public portfolio has rebounded notably aapl  28 since q1 endatuser daily results p1 520 gci twlo gdx gold slv cde bynd aapl now ba bili pins tlry evri vbiv rlgy ino data compiled by atuser follow the link in my bio for free accessnew to following atuser thank you for the aapl scalp trade really appreciate your approach to trading looking to great things in the futuremy trading is done for today 4 green trades in total spy only 151 stopped me out before that dump nvda 86 run out of contracts before dump  aapl 575 late entry but best win today tsla 444 also late entry wise old saying better be late than never ooo yesaapl 3125p atuser now from 89 plg runners only myp 31625 tgt hitaapl 3125p atuser now from 89c plg more here beastmodedear tech companies very few people trust you to protect their personal information in the us only 89 in the uk just 76 yep its that bad URL cybercrime dataprivacy privacy infosec covid19 covid19uk fb amzn aapl goog msftintuitive code ceo and fed powell warn sell everything to buy shopify atuser tsla aapl qqqtop watchers ba shop aapl fb amzn spyaapl amat amgn amtd amzn atvi trade long and short positions from the nasdaq up to 1500 since 2010 URL spy trading stock stocks trade system strategy market nyse nasdaq amex quotes signals tips qqq qqq diathe fed has our backs trading thoughts facebook shops mrna ino pfe baba googl aapl fb amzn bby hrl mdt tjx hpe intu nvda rost splk comp spx URL via atuserbreaking news  usa will delist almost 800 chinese companies from usa stock exchange URL baba bidu spy qqq spx aaplgood point i think if the number of floating shares is fixed and there are no stock splits then the market cap will be dominated by surviving stocks with the highest prices so price and market cap indices will be the same think of amzn googl aapl if not for stock split aapl in daily rwb uptrend 31st day of qqq short term uptrendhi permabears retest of the lows  unprecedented crash is coming  spy 180 trumpcrash depression is coming i would not buy the dip here nflx spx amzn fb dis acb tsla aapl zm spce msftaapl bullish setup within strong tech names  new video released right now watch here URL video on spy qqq iwm aapl fb amzn geaapl so close to getting out of the trendboxyou know before the big move happens when mike starts lighting up your timeline with that heat dis fb tlry bidu ma aapl spy amzn nflx googl cost wmt byndchallenge update 100dollartradingchallenge sold intc for 50 profit bought bcrx currently up 10 starting balance 100 currently balance 15144 spy spx qqq nflx amzn roku ba ttd bynd googl mrna mcd pypl amd rgen amgn unh aapl gs msft wmt hd URLif you could go back into time tosay november 2019 would you try to stop the pandemic from happening or use the event to profit from the markets aapl fb nflx spx spy twtr msft baba adbe amzn iwm dal aalaapl spy on the weekly looking strong coming to the pivot good sign for the marketatuser atuser trying some canslim tsm c 95 eps q1 yoy a 27 eps in 12 months ending q1 n us tech pressure to move home aapl ending intc chips amp switching to tsm amd s pending l yes big time i pend m upi know we are in the markets for one reason and one reason only to make money and maybe all that matters is how many nflx movies we watch it aapl store downloads we make or how much of the msft ecosystem we use while crops rot in the fields mortgages gosne aapl market chatter apple pays sony 70 million for 15 years of streaming rights to tom hanks movie greyhoundtsla hits 826 then pulls back to close at 81556 load pull backs  xspa jcp tti capr rvp cpe mrna nclh spom sbes nflx m mark prty qep oxy dxcm aapl home abt mro mpc teva shop mfa nvda amd msft tsla fb amzn srne pctl intc csco ccl amcjust waiting for the big green boner to put all these futures up 1 we all know futures arent allowed to be down spx spy es ym mes qqq tsla amzn aapl msft nflx googl jpm gs roku iwmhuawei says its operating system can rival google apple  but experts say it might be a struggle googl aapl nflx fbmajor week so far over 60000 in gains and 79 success rate aapl nflx amzn cccl cidm renn rmbl ttoo dis phun low fb nndmacwi this is touted as a global index but dominated by amzn aapl fb goog and then they try to throw in baba but most of the aforementioned are at all time highs and this etf still struggling clean bullish action in the sep 76 calls though but seems like a stupid etfaapl stock up 1 in premarket apple tv expands buying rights to older hollywood shows continue reading at coinspeaker URLvery important for perspective because this means the market makers are slaughtering retail that lives and dies by the clowns at atuser that bring on bigger clowns like atuser qqq spy spx vix vxx ps sven the options market is not the smart money fb aapl atuser close where do yall expect spy to be qqq dia ba tsla aapl amzn fb googl aapl amzn nflx faang emerges as the latest group to lead the market jim cramer says URL
